{
  "$schema": "https://json-schema.org/draft/2020-12/schema",
  "$id": "urn:udh:schema:adapter-report:1",
  "title": "adapter-report",
  "type": "object",
  "properties": {
    "schema_version": {
      "const": "udh.adapter/1"
    },
    "report_id": {
      "type": "string",
      "pattern": "^[A-Za-z0-9][A-Za-z0-9._:-]{0,127}$"
    },
    "observed_at": {
      "type": "string",
      "format": "date-time"
    },
    "dcode_version": {
      "type": "string",
      "minLength": 1
    },
    "sdk_version": {
      "type": "string",
      "minLength": 1
    },
    "python_version": {
      "type": "string",
      "minLength": 1
    },
    "runtime_lock_digest": {
      "type": "string",
      "pattern": "^sha256:[0-9a-f]{64}$"
    },
    "assurance_requested": {
      "type": "string",
      "enum": [
        "advisory",
        "governed"
      ]
    },
    "checks": {
      "type": "array",
      "items": {
        "type": "object",
        "properties": {
          "check_id": {
            "type": "string",
            "pattern": "^[A-Za-z0-9][A-Za-z0-9._:-]{0,127}$"
          },
          "surface": {
            "type": "string",
            "minLength": 1
          },
          "status": {
            "type": "string",
            "enum": [
              "verified",
              "unsupported",
              "failed",
              "not_tested"
            ]
          },
          "required_for_governed": {
            "type": "boolean"
          },
          "evidence": {
            "type": "array",
            "items": {
              "$ref": "#/$defs/artifact"
            },
            "minItems": 0
          },
          "limitation": {
            "type": [
              "string",
              "null"
            ]
          }
        },
        "required": [
          "check_id",
          "surface",
          "status",
          "required_for_governed",
          "evidence",
          "limitation"
        ],
        "additionalProperties": false
      },
      "minItems": 1
    },
    "governed_ready": {
      "type": "boolean"
    },
    "coverage_gaps": {
      "type": "array",
      "items": {
        "type": "string",
        "minLength": 1
      },
      "minItems": 0
    }
  },
  "required": [
    "schema_version",
    "report_id",
    "observed_at",
    "dcode_version",
    "sdk_version",
    "python_version",
    "runtime_lock_digest",
    "assurance_requested",
    "checks",
    "governed_ready",
    "coverage_gaps"
  ],
  "additionalProperties": false,
  "$defs": {
    "digest": {
      "type": "string",
      "pattern": "^sha256:[0-9a-f]{64}$"
    },
    "artifact": {
      "type": "object",
      "properties": {
        "artifact_id": {
          "type": "string",
          "pattern": "^[A-Za-z0-9][A-Za-z0-9._:-]{0,127}$"
        },
        "digest": {
          "type": "string",
          "pattern": "^sha256:[0-9a-f]{64}$"
        },
        "media_type": {
          "type": "string",
          "minLength": 1
        }
      },
      "required": [
        "artifact_id",
        "digest",
        "media_type"
      ],
      "additionalProperties": false
    },
    "scope": {
      "type": "object",
      "properties": {
        "workspace_id": {
          "type": "string",
          "pattern": "^[A-Za-z0-9][A-Za-z0-9._:-]{0,127}$"
        },
        "read": {
          "type": "array",
          "items": {
            "type": "string",
            "minLength": 1,
            "pattern": "^(?!/)(?!.*(?:^|/)\\.\\.(?:/|$))[^\\x00]+$"
          },
          "minItems": 0
        },
        "create": {
          "type": "array",
          "items": {
            "type": "string",
            "minLength": 1,
            "pattern": "^(?!/)(?!.*(?:^|/)\\.\\.(?:/|$))[^\\x00]+$"
          },
          "minItems": 0
        },
        "write_existing": {
          "type": "array",
          "items": {
            "type": "string",
            "minLength": 1,
            "pattern": "^(?!/)(?!.*(?:^|/)\\.\\.(?:/|$))[^\\x00]+$"
          },
          "minItems": 0
        },
        "delete": {
          "type": "array",
          "items": {
            "type": "string",
            "minLength": 1,
            "pattern": "^(?!/)(?!.*(?:^|/)\\.\\.(?:/|$))[^\\x00]+$"
          },
          "minItems": 0
        },
        "deny": {
          "type": "array",
          "items": {
            "type": "string",
            "minLength": 1,
            "pattern": "^(?!/)(?!.*(?:^|/)\\.\\.(?:/|$))[^\\x00]+$"
          },
          "minItems": 0
        },
        "recipe_ids": {
          "type": "array",
          "items": {
            "type": "string",
            "pattern": "^[A-Za-z0-9][A-Za-z0-9._:-]{0,127}$"
          },
          "minItems": 0
        },
        "network": {
          "type": "string",
          "enum": [
            "none",
            "allowlisted"
          ]
        },
        "network_allowlist": {
          "type": "array",
          "items": {
            "type": "string",
            "minLength": 1
          },
          "minItems": 0
        }
      },
      "required": [
        "workspace_id",
        "read",
        "create",
        "write_existing",
        "delete",
        "deny",
        "recipe_ids",
        "network",
        "network_allowlist"
      ],
      "additionalProperties": false
    },
    "budget": {
      "type": "object",
      "properties": {
        "max_model_attempts": {
          "type": "integer",
          "minimum": 1
        },
        "max_tool_calls": {
          "type": "integer",
          "minimum": 1
        },
        "max_seconds": {
          "type": "integer",
          "minimum": 1
        },
        "max_parallel_workers": {
          "type": "integer",
          "minimum": 1
        },
        "max_cost_usd": {
          "anyOf": [
            {
              "type": "string",
              "pattern": "^\\d+(?:\\.\\d+)?$"
            },
            {
              "type": "null"
            }
          ]
        }
      },
      "required": [
        "max_model_attempts",
        "max_tool_calls",
        "max_seconds",
        "max_parallel_workers",
        "max_cost_usd"
      ],
      "additionalProperties": false
    },
    "finding": {
      "type": "object",
      "properties": {
        "finding_id": {
          "type": "string",
          "pattern": "^[A-Za-z0-9][A-Za-z0-9._:-]{0,127}$"
        },
        "severity": {
          "type": "string",
          "enum": [
            "critical",
            "major",
            "minor",
            "info"
          ]
        },
        "category": {
          "type": "string",
          "enum": [
            "intent",
            "scope",
            "correctness",
            "security",
            "plan",
            "tests",
            "evidence",
            "operations",
            "style"
          ]
        },
        "summary": {
          "type": "string",
          "minLength": 1
        },
        "evidence_ids": {
          "type": "array",
          "items": {
            "type": "string",
            "pattern": "^[A-Za-z0-9][A-Za-z0-9._:-]{0,127}$"
          },
          "minItems": 0
        },
        "affected_ids": {
          "type": "array",
          "items": {
            "type": "string",
            "pattern": "^[A-Za-z0-9][A-Za-z0-9._:-]{0,127}$"
          },
          "minItems": 1
        },
        "required_resolution": {
          "type": "string",
          "minLength": 1
        }
      },
      "required": [
        "finding_id",
        "severity",
        "category",
        "summary",
        "evidence_ids",
        "affected_ids",
        "required_resolution"
      ],
      "additionalProperties": false
    },
    "bindings": {
      "type": "object",
      "properties": {
        "spec_digest": {
          "type": "string",
          "pattern": "^sha256:[0-9a-f]{64}$"
        },
        "plan_digest": {
          "anyOf": [
            {
              "type": "string",
              "pattern": "^sha256:[0-9a-f]{64}$"
            },
            {
              "type": "null"
            }
          ]
        },
        "scope_digest": {
          "type": "string",
          "pattern": "^sha256:[0-9a-f]{64}$"
        },
        "policy_digest": {
          "type": "string",
          "pattern": "^sha256:[0-9a-f]{64}$"
        },
        "snapshot_digest": {
          "type": "string",
          "pattern": "^sha256:[0-9a-f]{64}$"
        },
        "release_digest": {
          "type": "string",
          "pattern": "^sha256:[0-9a-f]{64}$"
        }
      },
      "required": [
        "spec_digest",
        "plan_digest",
        "scope_digest",
        "policy_digest",
        "snapshot_digest",
        "release_digest"
      ],
      "additionalProperties": false
    },
    "usage": {
      "type": "object",
      "properties": {
        "input_tokens": {
          "type": [
            "integer",
            "null"
          ],
          "minimum": 0
        },
        "output_tokens": {
          "type": [
            "integer",
            "null"
          ],
          "minimum": 0
        },
        "cached_input_tokens": {
          "type": [
            "integer",
            "null"
          ],
          "minimum": 0
        },
        "cache_write_tokens": {
          "type": [
            "integer",
            "null"
          ],
          "minimum": 0
        },
        "cost_usd": {
          "anyOf": [
            {
              "type": "string",
              "pattern": "^\\d+(?:\\.\\d+)?$"
            },
            {
              "type": "null"
            }
          ]
        },
        "currency": {
          "type": "string",
          "enum": [
            "USD"
          ]
        },
        "measurement": {
          "type": "string",
          "enum": [
            "reported",
            "estimated",
            "unavailable"
          ]
        },
        "cache_observation": {
          "type": "string",
          "enum": [
            "reported_hit",
            "reported_zero",
            "not_reported",
            "unsupported"
          ]
        },
        "source": {
          "type": [
            "string",
            "null"
          ]
        }
      },
      "required": [
        "input_tokens",
        "output_tokens",
        "cached_input_tokens",
        "cache_write_tokens",
        "cost_usd",
        "currency",
        "measurement",
        "cache_observation",
        "source"
      ],
      "additionalProperties": false
    }
  }
}
